{ "format": "motionary-timeline", "version": 1, "name": "動き — ties & 🙂", "layers": [
  { "id": "t", "type": "track", "keyframes": [
    { "id": "x2", "time": 100, "props": { "opacity": 0.5 } },
    { "id": "x1", "time": 100, "props": { "opacity": 0.25 }, "easing": "linear" },
    { "id": "x0", "time": 0, "props": { "opacity": 0, "filter": "blur(4px)" } },
    { "id": "x3", "time": 400, "props": { "filter": "none" } }
  ] }
] }
